{
  "schemaVersion": 1,
  "clientId": "sharm-divers-club",
  "platformVersion": "0.1.0-SNAPSHOT",
  "product": {
    "id": "wego-divers",
    "version": "0.1.0"
  },
  "contractVersions": {
    "httpApi": "v1"
  },
  "modules": [
    {
      "id": "platform.events",
      "version": "0.1.0-SNAPSHOT"
    },
    {
      "id": "platform.identity",
      "version": "0.1.0-SNAPSHOT"
    },
    {
      "id": "platform.security",
      "version": "0.1.0-SNAPSHOT"
    },
    {
      "id": "platform.transaction",
      "version": "0.1.0-SNAPSHOT"
    },
    {
      "id": "product.divers",
      "version": "0.1.0-SNAPSHOT"
    }
  ],
  "manifestDigests": {
    "client": "61d6a8d5b22ad52636e85a15c97afc131637207bcb06358bb9edd52065719914",
    "product": "2d740ac268e4c9d57a5e08412ea60bc9b206bff551a0e2615bb4e539941c5165",
    "moduleCatalog": "1d0e74b9935008d13a179cce88dcaf094e2a1a514f90e1c40a12314956d1b3cb"
  }
}
