{
  "schemaVersion": 1,
  "clientId": "safari-tours-sharm",
  "platformVersion": "0.1.0-SNAPSHOT",
  "product": {
    "id": "wego-tours-operator",
    "version": "0.1.0"
  },
  "contractVersions": {
    "httpApi": "v1"
  },
  "modules": [
    {
      "id": "platform.events",
      "version": "0.1.0-SNAPSHOT"
    },
    {
      "id": "platform.identity",
      "version": "0.1.0-SNAPSHOT"
    },
    {
      "id": "platform.security",
      "version": "0.1.0-SNAPSHOT"
    },
    {
      "id": "platform.transaction",
      "version": "0.1.0-SNAPSHOT"
    },
    {
      "id": "product.tours-operator",
      "version": "0.1.0-SNAPSHOT"
    }
  ],
  "manifestDigests": {
    "client": "aa26b7427e9427977e221ec97f910498c02d75068dae674a3a1bc757d40bcaf0",
    "product": "be9f71a252a365b8f4693a3b182209d6a91e285fa968a66a78768d029fa5dd51",
    "moduleCatalog": "1d0e74b9935008d13a179cce88dcaf094e2a1a514f90e1c40a12314956d1b3cb"
  }
}
